Other	%	Make a Fight (+0) or <b>Will (+0) check</b>. If you pass, you push through the walls of fatigue and confusion and realize what must be done. You may seal the gate through which you entered, but only by sacrificing yourself. If you choose to seal the gate, you are <b>devoured</b>. 	%	CP	%		%	b
Other	%	Make a <b>Luck (-1) check</b>. If you fail, a monster appears! If you pass, you may draw 2 monsters from the cup and choose which one appears. 	%	CP	%		%	b
Other	%	Something followed you here... if there are any monsters in the same location as the gate you entered, they appear. If they are not defeated, they remain in their original location. 	%	CP	%		%	b
Other	%	The stench of fecundity and blood surrounds you. A monster appears! If you do not evade it or defeat it on the first round of combat, it replicates, and you must evade or defeat a second one! 	%	CP	%		%	b
Other	%	You find the body of a long-dead explorer. Make a <b>Luck (-2) check</b>. For each success, you may draw and keep one card from the Common Item deck. 	%	CP	%		%	b
Other	%	A monster appears! 	%	DH	%		%	b
Other	%	Hurry! You must choose the correct crystal soon, or the gate will open and release a terrible creature. Pass a <b>Luck (-2) check</b> or a monster appears! 	%	DH	%		%	b
Other	%	It seems that you are not the first to have come here. Gain <b><font color='#53FF54'>1 Clue Token</font></b>and $2. 	%	DH	%		%	b
Other	%	Muttering a quick prayer, you hope that the grate is weak enough to remove, since it's the only way forward that you've found so far. Pass a <b>Luck (-1) check</b> or stay here next turn. 	%	DH	%		%	b
Other	%	Pass a <b>Luck (-1) check</b> to find something of use among the devastation. Draw 1 Common Item. 	%	DH	%		%	b
Other	%	The journey proves fruitful. Draw 1 Spell. 	%	DH	%		%	b
Other	%	Try as you might, you are too tired to go on. Stay here next turn. 	%	DH	%		%	b
Other	%	What luck! There's a way home here that you almost overlooked. Return to Arkham. 	%	DH	%		%	b
Other	%	You come upon a cavern filled with human brains. If you were to eat them, maybe you could also consume the knowledge they contain! Make a <b>Lore (-1) check</b>. If you pass, you may lose <b><font color='#00A2FE'>Sanity</font></b> to take <b><font color='#53FF54'>Clue Tokens</font></b>, at a rate of <b><font color='#00A2FE'>2 Sanity</font></b> each.	%	KH	%		%	b
Other	%	Dark tendrils grasp you! Pass a <b>Luck (-1) check</b> or be <i>delayed</i>.	%	KH	%		%	b
Other	%	Stairs wind upward, yet descend downward - ascend, or fall? Pass a <b>Luck (-1) check</b> or you are <i>lost in time and space</i>.	%	KH	%		%	b
Other	%	The way is shut, and more doors close with each passing eon. If there are four or more elder sign tokens in play, take this cord. While you have it, during Upkeep, you must discard a <b><font color='#53FF54'>Clue Token</font></b>or 1 Item, if you have either.	%	KH	%		%	b
Other	%	Riding a spear of light, you flash through a thousand times and places. Pass a <b>Luck (-1) [2]check</b> to return to Arkham. Any monsters in the location you return to are automatically defeated and collected as trophies.	%	KH	%		%	b
Other	%	An unspeakable monster appears!	%	KH	%		%	b
Other	%	A horrendous monster appears!	%	KH	%		%	b
Other	%	A horrible shadow falls across you. Roll a die. On a 1, either lose <b><font color='#53FF54'>5 Clue Tokens</font></b> or you are <b>devoured</b>. 	%	KY	%		%	b
Other	%	A monster appears! 	%	KY	%		%	b
Other	%	A strange being pays you a visit, and test you. Make a <b>Will (-2) check</b>. If you fail, you lose <b><font color='#00A2FE'>1 Sanity</font></b> and <b><font color='#FF4442'>1 Stamina</font></b>. If you pass, you gain <b><font color='#53FF54'>3 Clue Tokens</font></b>. 	%	KY	%		%	b
Other	%	A tree, covered in blood and waving in the wind, stands before you. If you pass a <b>Luck (-1) check</b>, it is just a tree. If you fail, it attacks you! Lose <b><font color='#00A2FE'>1 Sanity</font></b> and <b><font color='#FF4442'>2 Stamina</font></b>. 	%	KY	%		%	b
Other	%	Eerie purple lights begin wending their way towards you. Pass a <b>Will (+0) check</b> or you are drawn to them and <i>delayed</i>. 	%	KY	%		%	b
Other	%	If you have a Unique Item, nothing happens this turn. If you do not have one, the winds seem to taunt you, mocking your helplessness. Lose <b><font color='#00A2FE'>2 Sanity</font></b>. 	%	KY	%		%	b
Other	%	It takes you a moment to realize that the horrible screeching noise consists of English words spoken by something monstrous! Lose <b><font color='#00A2FE'>1 Sanity</font></b>, but gain <b><font color='#53FF54'>1 Clue Token</font></b>. 	%	LT	%		%	b
Other	%	Make a <b>Fight (-2) check</b> to scale that sheer cliff. If you succeed, the view from the top grants you <b><font color='#53FF54'>1 Clue Token</font></b>. If you fail, lose <b><font color='#FF4442'>1 Stamina</font></b>. 	%	LT	%		%	b
Other	%	The ground is giving way! Pass a <b>Speed (-1) check</b> to escape; otherwise you are <i>delayed</i>. 	%	LT	%		%	b
Other	%	What was that? Lose <b><font color='#00A2FE'>1 Sanity</font></b>. 	%	LT	%		%	b
Other	%	What's that? Another Gate? Hurry! Make a <b>Speed (-1) check</b>'. If you fail, you are <i>lost in time and space</i>. If you pass with 1 success, nothing happens. If you pass with 2 or more successes, return to Arkham. 	%	LT	%		%	b
Other	%	You find a $5 bill on the ground here, with no possible explanation for its presence. Gain $5. 	%	LT	%		%	b
Other	%	A web of light surrounds the object on the pedestal. You may draw a Unique Item, but if you do, every other investigator loses <b><font color='#00A2FE'>1 Sanity</font></b> and 1 Statmina. 	%	KH	%		%	b
Other	%	A glimpse of home gives you hope. Gain <b><font color='#00A2FE'>1 Sanity</font></b>. 	%	AH	%		%	g
Other	%	Carefully, you avoid the gaze of a gigantic eye watching an alter. You may try to pass a <b>Sneak (-1) check</b> to steal a scroll from the dais. Draw 1 Spell. If you fail, you are racked by pain and lose <b><font color='#00A2FE'>3 Sanity</font></b>. 	%	AH	%		%	g
Other	%	Pass a <b>Fight (-2) check</b> to pry open a grate you find built into the wall. Inside, you find something fascinating. Draw 1 Unique Item. 	%	AH	%		%	g
Other	%	Pass a <b>Luck (-1) check</b> to discover a vital document. Gain <b><font color='#53FF54'>2 Clue Tokens</font></b>. 	%	AH	%		%	g
Other	%	Pass a <b>Luck (-1) check</b> to find the gate back. If so, immediately return to Arkham. 	%	AH	%		%	g
Other	%	The rope seems to extend upwards forever, but it's the only way out of the crevasse you find yourself in. Pass a <b>Fight (-1) check</b> to climb it and return to Arkham. If you fail, you fall, losing <b><font color='#FF4442'>2 Stamina</font></b> and staying here next turn. 	%	AH	%		%	g
Other	%	Wedged beneath a fallen stone is a scroll. Draw 1 Spell. 	%	AH	%		%	g
Other	%	You are beginning to understand the strange creatures here. Gain <b><font color='#53FF54'>1 Clue Token</font></b>. 	%	AH	%		%	g
Other	%	You come across a slaughtered creature. Pass a <b>Luck (-1) check</b> to claim a monster trophy from the cup (even if it is Endless) and gain <b><font color='#53FF54'>2 Clue Tokens</font></b>. 	%	AH	%		%	g
Other	%	You come across a sleeping horror with a tentacle draped across a small gold idol. Silence is of the essence as you attempt to gently ease the idol out from under the creature's pseudopod. Make a <b>Sneak (-1) check</b>. If you pass, gain $3. If you fail, lose <b><font color='#FF4442'>2 Stamina</font></b>. 	%	AH	%		%	g
Other	%	You find a quiet spot to rest and recuperate. Gain <b><font color='#FF4442'>1 Stamina</font></b>. 	%	AH	%		%	g
Other	%	You find some valuable items that you can sell back in Arkham. Gain $3. 	%	AH	%		%	g
Other	%	A ghostly ship captain offers you passage home, for a price. Return to Arkham, but you are <i>Cursed</i>. 	%	BG	%		%	g
Other	%	A wounded beast snarls at you, but it can't move. You don't think it's going to live much longer. If you want to wait around, you are <i>delayed</i>, but you may draw a monster from the cup and take it as a monster trophy, even if it has the Endless ability. 	%	BG	%		%	g
Other	%	At the top of the hill is an old stone well. You may toss $1 inside and pass a <b>Luck (-2) check</b> to be <i>Blessed</i>. If you fail, nothing happens. 	%	BG	%		%	g
Other	%	In the dark, you stumble into a deep hole. Looking up, you see a gravestone bearing your name. Pass a <b>Speed (-2) check</b> to scramble out or lose <b><font color='#00A2FE'>2 Sanity</font></b> and be <i>delayed</i>. 	%	BG	%		%	g
Other	%	It's a dead end. You are <i>delayed</i> as you must retrace your path and try something different. 	%	BG	%		%	g
Other	%	You are not safe here. A monster appears! 	%	BG	%		%	g
Other	%	A dark ocean laps at your feet, and you see gables of old-fashioned buildings across the water. Could this be Innsmouth? Your Luck slider is reset to the lowest possible number, but you gain <b><font color='#53FF54'>1 Clue Token</font></b>. 	%	CP	%		%	g
Other	%	A man in a coat and hat takes your arm, and you find yourself leading the shadowy presence forward. All the reward you seem to need is his reassurance... perhaps you are being mystically controlled, but it's hard to care. Gain <b><font color='#00A2FE'>1 Sanity</font></b>, but take the Local Guide card. 	%	CP	%		%	g
Other	%	A strange song conjures up images of a life you could have lived. Gain <b><font color='#53FF54'>Clue Tokens</font></b> equal to your focus. 	%	CP	%		%	g
Other	%	Pass a <b>Speed (-2) check</b> to jump the fissure. If you fail, lose <b><font color='#FF4442'>1 Stamina</font></b> and you are <i>delayed</i>. 	%	CP	%		%	g
Other	%	The monster's corpse lies before you, and to your horror, you find your mouth watering. If you consum it, make a <b>Fight (-2) check</b>. If you fail, lose <b><font color='#FF4442'>Stamina</font></b> equal to the number of dice rolled. If you pass, gain <b><font color='#FF4442'>Stamina</font></b> equal to the number of dice rolled. 	%	CP	%		%	g
Other	%	You approach a tunnel only to feel a terrible tromping shake the ground from below... and then an unearthly screech rends the sky. Make a <b>Sneak (-1) check</b>. If you pass, 1 monster appears! If you fail, 2 monsters appear! 	%	CP	%		%	g
Other	%	A monster appears! 	%	CP	%		%	g
Other	%	Excellent! There seems to be a narrow passage leading back. Return to Arkham. 	%	DH	%		%	g
Other	%	In this place, it's a stroke of good fortune when nothing terrible happens to you. No encounter. 	%	DH	%		%	g
Other	%	Pass a <b>Luck (-2) check</b> to stumble across a valuable item. Take the first Unique Item with a list price of at least $4 from the Unique Item deck. 	%	DH	%		%	g
Other	%	Perhaps there's something of use here? Pass a <b>Luck (-1) check</b> to either draw 1 Unique Item or draw 1 Common Item and gain $2. If you fail the check, nothing happens. 	%	DH	%		%	g
Other	%	Placing your hand on the ancient cave painting, you have a vision. Gain <b><font color='#53FF54'>1 Clue Token</font></b>. 	%	DH	%		%	g
Other	%	The creature waves its hand at you. "Blessings upon you." If you have a Curse card, you may discard it. 	%	DH	%		%	g
Other	%	There are two paths for you to choose between. One of them leads home, while the other could lead anywhere. Pass a <b>Luck (-1) check</b> to return to Arkham. 	%	DH	%		%	g
Other	%	Yes! You think you have a use for this item. Draw 1 Common Item. 	%	DH	%		%	g
Other	%	You grasp at the thing, but sense that even if you are unable to hold it, the reaching itself will teach you. Make a <b>Luck (-2) check</b>. If you pass, draw a Unique Item. If you fail, take a <b><font color='#53FF54'>Clue Token</font></b>.	%	KH	%		%	g
Other	%	A window floats by, looking out on...can it be? Home? Pass a <b>Luck (-1) check</b> to return to Arkham.	%	KH	%		%	g
Other	%	"It is not too late," whispers the voice in the darkness. If the terror level is less than 6, draw a Spell.	%	KH	%		%	g
Other	%	You pick up a shock-while feather from the cracked ground, sensing something strange about it. Keep this card. You may discard it to prevent any investigator from losing up to <b><font color='#00A2FE'>3 Sanity</font></b> or <b><font color='#FF4442'>Stamina</font></b>.	%	KH	%		%	g
Other	%	Strength - and knowledge? - in numbers. Take a <b><font color='#53FF54'>Clue Token</font></b> for every investigator, including you, currently in an Other World.	%	KH	%		%	g
Other	%	You find tiny corner a placidity, and remain there for a moment. Gain <b><font color='#FF4442'>1 Stamina</font></b> and <b><font color='#00A2FE'>1 Sanity</font></b>.	%	KH	%		%	g
Other	%	In this place, where all minds converge, you may trade <b><font color='#53FF54'>Clue Tokens</font></b> with other investigators until the end of this phase.	%	KH	%		%	g
Other	%	Along the shore, the cloud waves break. Pass a <b>Fight (+1) check</b> to gain <b><font color='#FF4442'>1 Stamina</font></b>. 	%	KY	%		%	g
Other	%	Black stars shine upon you, and reality is reversed. If you were <i>Cursed</i>, you are now <i>Blessed</i>. If you were <i>Blessed</i>, you are now <i>Cursed</i>. 	%	KY	%		%	g
Other	%	Exhausted, you lay down and sleep for a while. You are <i>delayed</i>. 	%	KY	%		%	g
Other	%	In some alternate history, you see a United States plunged into dictatorship. Suicide chambers are erected in city parks. This could be the shape of things to come. Gain <b><font color='#53FF54'>2 Clue Tokens</font></b> and lose <b><font color='#00A2FE'>1 Sanity</font></b>. 	%	KY	%		%	g
Other	%	"Is that you, Camilla?" a voice calls to you in the darkness. If you flee, lose <b><font color='#FF4442'>1 Stamina</font></b>. If you answer, pass a <b>Will (-2) check</b> or lose <b><font color='#00A2FE'>2 Sanity</font></b>. 	%	KY	%		%	g
Other	%	The shadows of men's thoughts lengthen in the afternoon. Pass a <b>Lore (-2) check</b> to gain <b><font color='#53FF54'>Clue Tokens</font></b> equal to the number of successes you roll. 	%	KY	%		%	g
Other	%	You reach out and touch a great pillar of darkness, anchoring your lost allies. If there are any investigators <i>lost in time and space</i>, you return to Arkham, and they are moved to the street location nearest you.	%	KH	%		%	g
Other	%	Make a <b>Luck (-2) check</b> to come across a Unique Item! 	%	LT	%		%	g
Other	%	Make a <b>Speed (-1) check</b> to run for safety and return to Arkham. If you fail, you are caught and are <i>delayed</i>. 	%	LT	%		%	g
Other	%	Silence and warmth, for a change. Gain <b><font color='#00A2FE'>1 Sanity</font></b>. 	%	LT	%		%	g
Other	%	There are two flasks here. You may drink one to gain <b><font color='#00A2FE'>1 Sanity</font></b> and lose <b><font color='#FF4442'>1 Stamina</font></b> or drink the other to gain <b><font color='#FF4442'>1 Stamina</font></b> and lose <b><font color='#00A2FE'>1 Sanity</font></b>. 	%	LT	%		%	g
Other	%	These loathsome beings are certainly not friendly. Make a <b>Sneak (-1) check</b> to avoid them and gain <b><font color='#53FF54'>1 Clue Token</font></b>. If you fail, lose <b><font color='#00A2FE'>1 Sanity</font></b> and <b><font color='#FF4442'>1 Stamina</font></b> as you flee! 	%	LT	%		%	g
Other	%	You pass the night in animated conversation with an old man sucking on a clay pipe. When you awaken, the man is gone without a trace, but you do gain <b><font color='#53FF54'>1 Clue Token</font></b>from his wisdom. 	%	LT	%		%	g
Other	%	A lurking monster appears! 	%	AH	%		%	r
Other	%	Pass a <b>Luck (-1) check</b> to discover a useful object in your wanderings. Draw 1 Unique Item. 	%	AH	%		%	r
Other	%	Pass a <b>Luck (-1) check</b> to find a quiet spot to rest. Gain <b><font color='#FF4442'>2 Stamina</font></b> and <b><font color='#00A2FE'>2 Sanity</font></b>. 	%	AH	%		%	r
Other	%	Pass a <b>Speed (-1) check</b> to grab the carving before it falls. Draw 1 Spell. 	%	AH	%		%	r
Other	%	The colors are blinding. Pass a <b>Lore (-1) check</b> or stay here next turn. 	%	AH	%		%	r
Other	%	The humidity and heat is exhausting. Lose <b><font color='#FF4442'>1 Stamina</font></b>. 	%	AH	%		%	r
Other	%	The obsidian door refuses to open. Pass a <b>Fight (-1) check</b> or stay here next turn, struggling with it. 	%	AH	%		%	r
Other	%	The pinkish rays nearly get you. Pass a <b>Sneak (+0) check</b> or lose <b><font color='#FF4442'>2 Stamina</font></b>. 	%	AH	%		%	r
Other	%	The shadowy entity gives up the chase. Lose <b><font color='#FF4442'>1 Stamina</font></b> from exhaustion. 	%	AH	%		%	r
Other	%	There is nothing here but barren wastes. No encounter. 	%	AH	%		%	r
Other	%	You push yourself to the limit. Roll one die for each point of <b><font color='#FF4442'>Stamina</font></b> you have. Lose <b><font color='#FF4442'>1 Stamina</font></b> for each die that does not roll a success. If you do not fall unconscious, gain <b><font color='#53FF54'>1 Clue Token</font></b> for each die that rolled a success. 	%	AH	%		%	r
Other	%	You sleep, fitfully, and awaken to the sound of your own voice, chanting something. Make a <b>Lore (-2) check</b>. If you pass, you are able to retain what you are saying. Draw 1 Spell and gain <b><font color='#53FF54'>2 Clue Tokens</font></b>. If you fail, the chant attracts something unsavory. A monster appears! 	%	AH	%		%	r
Other	%	A crazed, half-dead explorer attacks you. Pass a <b>Fight (+2) check</b> to overcome him. If you succeed, take 1 Common Item and lose <b><font color='#00A2FE'>1 Sanity</font></b> as you contemplate this poor soul's fate. If you fail, lose <b><font color='#FF4442'>1 Stamina</font></b>. 	%	BG	%		%	r
Other	%	A mysterious woman warns you that you would be able to see all that you need to know if your mind were not clouded by the unnatural. Discard 2 Spells to gain <b><font color='#53FF54'>5 Clue Tokens</font></b>. If you can't or choose not to, gain <b><font color='#00A2FE'>1 Sanity</font></b>. 	%	BG	%		%	r
Other	%	A strange rash has appeared on your skin, and you've developed a harsh, rattling cough. Lose <b><font color='#FF4442'>1 Stamina</font></b>. 	%	BG	%		%	r
Other	%	A terrible monster appears! 	%	BG	%		%	r
Other	%	The air here is too noxious. You don't think you can make it. Pass a <b>Speed (-1) check</b> or lose <b><font color='#FF4442'>1 Stamina</font></b>. 	%	BG	%		%	r
Other	%	You find a fresh water source that replenishes you. Gain <b><font color='#FF4442'>1 Stamina</font></b>. 	%	BG	%		%	r
Other	%	A monster appears! 	%	CP	%		%	r
Other	%	It was a diabolical trap, you suddenly realize... now that you're inside it! Make a <b>Lore (-1) check</b> or you are <i>delayed</i>. 	%	CP	%		%	r
Other	%	The chess game with the strange serpent seems to go on for days. Pass a <b>Lore (+2) check</b> to gain $1 for each success you roll. If you fail, you are <i>delayed</i>. 	%	CP	%		%	r
Other	%	The mad scientist cackles as he pulls down on the lever of his machine. Pass a <b>Speed (+1) check</b> to reach the giant gem that powers it in time and gain $4. If you fail, you are thrown through a portal. Draw a Gate card, move to the Other World listed first, and have another encounter there. 	%	CP	%		%	r
Other	%	What was that!? Make a <b>Sneak (+3) check</b> or you will find out as you are <b>devoured</b> by it. 	%	CP	%		%	r
Other	%	You can hear it breathing... make a <b>Will (-1) check</b>. If you fail, you scream in terror, giving yourself away. Lose <b><font color='#00A2FE'>1 Sanity</font></b> and <b><font color='#FF4442'>2 Stamina</font></b>. 	%	CP	%		%	r
Other	%	A hideous monster appears! 	%	DH	%		%	r
Other	%	A terrible monster appears! 	%	DH	%		%	r
Other	%	Although you believe that you've found a way home, the path looks perilous. You may roll 3 dice, losing <b><font color='#FF4442'>1 Stamina</font></b> for each failure you roll. If you are not reduced to <b><font color='#FF4442'>0 Stamina</font></b>, you may return to Arkham. 	%	DH	%		%	r
Other	%	Struggling to hold your breath, you cannot seem to find the surface of the mysterious sea. Lose <b><font color='#00A2FE'>1 Sanity</font></b> and <b><font color='#FF4442'>1 Stamina</font></b>. 	%	DH	%		%	r
Other	%	The endless forest refuses to give up its mysteries. No encounter. 	%	DH	%		%	r
Other	%	The fumes overcome you at last, causing you to sink into a dreamless sleep. Stay here next turn. 	%	DH	%		%	r
Other	%	The ground shifts under you feet, sending you tumbling head over heels. Lose <b><font color='#FF4442'>1 Stamina</font></b>. 	%	DH	%		%	r
Other	%	The sucking mouths drain enough of your blood to leave you dizzy. Lose <b><font color='#FF4442'>1 Stamina</font></b>. 	%	DH	%		%	r
Other	%	Knowledge is power, but more importantly, it is hope and endurance in this prison where you find yourself. Lose <b><font color='#FF4442'>3 Stamina</font></b> and <b><font color='#00A2FE'>3 Sanity</font></b>, but you may reduce this loss by <b><font color='#FF4442'>1 Stamina</font></b> and <b><font color='#00A2FE'>1 Sanity</font></b> for each <b><font color='#53FF54'>Clue Token</font></b>you discard (to a maximum of three).	%	KH	%		%	r
Other	%	The weight of worlds presses down on you. Lose I <b><font color='#FF4442'>Stamina</font></b>.	%	KH	%		%	r
Other	%	If violence is all it understands. then violence it shall have! Pass a <b>Fight (-1) check</b> to take a <b><font color='#53FF54'>Clue Token</font></b>.	%	KH	%		%	r
Other	%	Ten thousand worlds lie arrayed before you; you are <i>delayed</i>.	%	KH	%		%	r
Other	%	A nightmarish monster appears!	%	KH	%		%	r
Other	%	In a quiet comer removed from every place and no place at once, you snatch a moment of respite, and have no encounter.	%	KH	%		%	r
Other	%	Crushing tentacles pursue you! Pass a <b>Speed (-1) check</b> or you are reduced to <b><font color='#FF4442'>1 Stamina</font></b>.	%	KH	%		%	r
Other	%	Your travels are endless, packed tight into the space of but a moment. Lose <b><font color='#FF4442'>1 Stamina</font></b>.	%	KH	%		%	r
Other	%	A large dog lopes alongside you for a time, warding you from harm. No encounter. 	%	KY	%		%	r
Other	%	A monster appears! 	%	KY	%		%	r
Other	%	A vortex sweeps you off your feet and into oblivion. Pass a <b>Fight (+0) check</b> or you are lost in space and time. 	%	KY	%		%	r
Other	%	For once, fortune is with you. No encounter. 	%	KY	%		%	r
Other	%	The tides of time and space collide. You meet your future self, and learn what is in store. Gain <b><font color='#53FF54'>1 Clue Token</font></b>, the pass a <b>Will (+0) check</b> or lose <b><font color='#00A2FE'>1 Sanity</font></b>. 	%	KY	%		%	r
Other	%	You wrestle shadows for what seems like days, only to emerge into a plain of blinding light. Lose either <b><font color='#FF4442'>1 Stamina</font></b> or <b><font color='#00A2FE'>1 Sanity</font></b>. 	%	KY	%		%	r
Other	%	A terrifying monster appears! 	%	LT	%		%	r
Other	%	Make a <b>Luck (+0) check</b> and consult the chart below.<br><b>Successes:</b><br><b>0-1)</b> Thousands of minute creatures! Lose <b><font color='#FF4442'>1 Stamina</font></b>.<br><b>2)</b> You find $2 worth of gold ingots.<br><b>3++)</b> Anywhere is better than here. Return to Arkham.	%	LT	%		%	r
Other	%	Nothing but emptiness. No encounter. 	%	LT	%		%	r
Other	%	The bruising winds make movement difficult. Lose <b><font color='#FF4442'>1 Stamina</font></b>. 	%	LT	%		%	r
Other	%	The door slams shut behind you. You are in total blackness. Pass a <b>Luck (-2) check</b>, otherwise you are <i>delayed</i>. 	%	LT	%		%	r
Other	%	The floor is crumbling beneath you! Make a <b>Speed (-1) check</b> or be <i>lost in time and space</i>. 	%	LT	%		%	r
Other	%	A glimmer of gold catches your eye. Gain $2. 	%	AH	%		%	y
Other	%	A monster appears from the shadows! 	%	AH	%		%	y
Other	%	A monster appears! 	%	AH	%		%	y
Other	%	A ripple in the air passes over you. Pass a <b>Lore (-1) check</b> or lose 1 Spell of your choice as it is burned from your mind. 	%	AH	%		%	y
Other	%	Suddenly you notice something that you had previously missed. Gain <b><font color='#53FF54'>1 Clue Token</font></b>. 	%	AH	%		%	y
Other	%	Suddenly, the things you've seen make sense! Gain <b><font color='#53FF54'>1 Clue Token</font></b>. 	%	AH	%		%	y
Other	%	The unending blackness terrifies you. Pass a <b>Will (-1) check</b> or lose <b><font color='#00A2FE'>1 Sanity</font></b> and <b><font color='#FF4442'>1 Stamina</font></b> from fear and exhaustion. 	%	AH	%		%	y
Other	%	Time and space bend around you. Make a <b>Luck (-1) check</b>. If you pass, return to Arkham. If you fail, stay here next turn. 	%	AH	%		%	y
Other	%	You are not safe here. A monster appears! 	%	AH	%		%	y
Other	%	You stare into the face of madness. Roll 1 die for each point of <b><font color='#00A2FE'>Sanity</font></b> you have. Lose <b><font color='#00A2FE'>1 Sanity</font></b> for each die that does not roll a success. If you do not go insane, gain <b><font color='#53FF54'>1 Clue Token</font></b> for each die that rolled a success. 	%	AH	%		%	y
Other	%	Your mind is flooded with knowledge. Make a <b>Lore (-2) check</b>. If you pass it, draw 1 Spell, but lose <b><font color='#00A2FE'>1 Sanity</font></b>. 	%	AH	%		%	y
Other	%	A ghastly monster appears! 	%	BG	%		%	y
Other	%	This area is filled with discarded antiques from Earth. Most of it is junk, but some of it might be worth something. Gain $3. 	%	BG	%		%	y
Other	%	You are unsure if you are back in Arkham or not. Make a <b>Will (-2) check</b>. If you succeed, return to Arkham. If not, lose <b><font color='#00A2FE'>2 Sanity</font></b> as the landscape twists and warps in a nightmarish way. 	%	BG	%		%	y
Other	%	You feel a powerful pulse of malevolent intelligence. It wants to tell you secrets. For each point of <b><font color='#00A2FE'>Sanity</font></b> you sacrifice, you may gain <b><font color='#53FF54'>1 Clue Token</font></b>. 	%	BG	%		%	y
Other	%	You find a small gem that you plan on selling when you get the chance. Gain $3. 	%	BG	%		%	y
Other	%	Your path ends at two identical doors. Make a <b>Luck (+0) check</b>. If you succeed, return to Arkham. If not, you are <i>lost in time and space</i>. 	%	BG	%		%	y
Other	%	A monster appears! 	%	CP	%		%	y
Other	%	A monster appears! 	%	CP	%		%	y
