Abyss	%	A glowing light ahead draws you towards it. Make a <b>Luck (-1) check</b>. If you pass, the glow is a way home. Return to Arkham. If you fail, the light is a trap set by one of the creatures that lives here. A monster appears! 	%	AH	%		%	
Abyss	%	A monster appears! 	%	AH	%		%	
Abyss	%	Pass a <b>Luck (-1) check</b> or you are faced with an enormous mountain with a strange symbol carved into it, as if by the claw of a gigantic creature. THe world swims around you and you lose <b><font color='#00A2FE'>3 Sanity</font></b>. 	%	AH	%		%	
Abyss	%	Pass a <b>Speed (-1) check</b> to avoid a monstrous mass. If you fail, you are <i>lost in time and space</i>. 	%	AH	%		%	
Abyss	%	Starving, you consider eating some of the glowing mushrooms. If you decide to do so, make a <b>Luck (-1) check</b>. If you fail, roll a die and lose that much <b><font color='#FF4442'>Stamina</font></b>. If you succeed, roll a die and gain that much <b><font color='#FF4442'>Stamina</font></b>. 	%	AH	%		%	
Abyss	%	The caverns split. Make a <b>Luck (+1) check</b> and consult the chart below:<br><b>Successes:</b><br><b>0-1)</b> Move to the Black Cave<br><b>2)</b> Move to The Dreamlands.<br><b>3+)</b> You enter a dark temple. Pass a <b>Luck (-1) check</b> to draw a Unique Item.	%	AH	%		%
Abyss	%	The feeble glow and warmth of the candle is enough to restore you a bit. Gain <b><font color='#FF4442'>1 Stamina</font></b>. 	%	AH	%		%	
Abyss	%	The stone arch breaks! Pass a <b>Speed (-1) check</b> to dive out of the way or roll a die and lose that much <b><font color='#FF4442'>Stamina</font></b>. 	%	AH	%		%	
Abyss	%	You are bewildered. Pass a <b>Lore (-1) check</b> or stay here next turn. 	%	AH	%		%	
Abyss	%	You are disturbed by unsettling echoes. Pass a <b>Sneak (-1) check</b> to quiet them or lose <b><font color='#00A2FE'>2 Sanity</font></b>. 	%	AH	%		%	
Abyss	%	You are lost in the darkness. Pass a <b>Luck (-2) check</b> or lose <b><font color='#00A2FE'>1 Sanity</font></b> and stay here next turn. 	%	AH	%		%	
Abyss	%	You rest a bit beside a small, glowing pool filled with black, blind fish. Pass a <b>Luck (-1) check</b> to notice an unusual object in the water. Fishing it out, you draw 1 Unique Item and gain $3. 	%	AH	%		%	
Abyss	%	A monster appears! 	%	BG	%		%	
Abyss	%	It is the little things that comfort you in your darkest hour. You think fondly of the mundane joys of your life. Regain <b><font color='#00A2FE'>1 Sanity</font></b> for each Common Item you possess. 	%	BG	%		%	
Abyss	%	The darkness claws at your mind, obscuring what was once so clear to you. Make a <b>Will (-1) check</b>. For each success you roll, you may keep <b><font color='#53FF54'>1 Clue Token</font></b>, losing the others. 	%	BG	%		%	
Abyss	%	You can feel bleak despair taking over your mind. Make a <b>Will (-2) check</b>. If you pass, regain <b><font color='#00A2FE'>1 Sanity</font></b>. If you do not, you leap blindly into the yawning darkness and are <i>lost in time and space</i>. 	%	BG	%		%	
Abyss	%	You discover a large chamber filled with hideous creatures, in numbers too vast to count. Your only hope is to pass undetected. Pass a <b>Sneak (+1) check</b> or be <b>devoured</b>. 	%	BG	%		%	
Abyss	%	Your journey through the darkness is slow but restful. you are restored to your maximum <b><font color='#FF4442'>Stamina</font></b>, but are <i>delayed</i>. 	%	BG	%		%	
Abyss	%	A horrible scene captures your gaze. Creatures that mortals would call angels and devils cavort together, their bodies and laughter mingling in an unholy fusion. If you join their dance, take both the Tainted card and the Anointed card. 	%	CP	%		%	
Abyss	%	Something impossibly huge and ominous lurches across the horizon. Pass a <b>Luck (-1) check</b> or its gaze, with eyes the size of planets, falls upon you, and you lose <b><font color='#00A2FE'>2 Sanity</font></b>. 	%	CP	%		%	
Abyss	%	The faces of those you have failed erupt from the earth around you, accusing, pleading, hating. Pass a <b>Lore (-1) [2]check</b> to take the Psychic card. If you roll only 1 success, you must take either the Tainted or Harried card, and if you roll no successes, you must take both the Harried and Tainted cards. 	%	CP	%		%	
Abyss	%	This place is alive with malevolent intent. It likes it when you inflict pain upon yourself. Discard any amount of <b><font color='#FF4442'>Stamina</font></b>, all at once; for each <b><font color='#FF4442'>Stamina</font></b> token you discarded, pass a <b>Will (-1) check</b> to gain <b><font color='#53FF54'>2 Clue Tokens</font></b>. 	%	CP	%		%	
Abyss	%	This place seduces you into madness with hints of escape. Discard any amount of <b><font color='#00A2FE'>Sanity</font></b>, all at once; for each <b><font color='#00A2FE'>Sanity</font></b> token you discarded, pass a <b>Fight (-1) check</b> to gain <b><font color='#53FF54'>2 Clue Tokens</font></b>. 	%	CP	%		%	
Abyss	%	You look into a pool of water and see someone! Choose another investigator and make a <b>Will (-2) check</b>.<br><b>Successes:</b><br><b>0)</b> He is drawn into the Abyss.<br><b>1-2)</b> You and he switch places.<br><b>3++)</b> You move to his location, and the gate through which you entered the Abyss is sealed.	%	CP	%		%	
Abyss	%	Alone in the darkness with only your thoughts, you make what peace with yourself you can. Gain <b><font color='#00A2FE'>1 Sanity</font></b>. 	%	DH	%		%	
Abyss	%	Countless voices chitter and gibber in the caves, driving you to the brink of insanity and causing your arcane lore to become jumbled. Roll a die for each Spell you have, discarding it on a failure. 	%	DH	%		%
Abyss	%	If Azathoth is the Ancient One, then make a <b>Luck (+0) [3]check</b>. If you fail, you find yourself at the center of the universe and one look at the creatures there blasts your mind to jelly. You are <b>devoured</b>. If you pass, nothing happens. 	%	DH	%		%	
Abyss	%	Pass a <b>Luck (-2) check</b> or the shadowy creatures capture you and torture you for days. Draw 1 Injury and 1 [[Madness] card, then discard one of them of your choice. If you pass, you escape with the idol's jeweled eyes. Gain $5. 	%	DH	%		%	
Abyss	%	Halfway down the cliff, you manage to grab onto a stone outcropping. Looking back up to where you fell from, the question remains - climb back up or climb down?<br><br>If you climb back up, pass a <b>Fight (-2) check</b> to safely reach the top and return to Arkham. If you fail, you are <i>delayed</i>.<br><br>If you climb down, make a <b>Luck (-1) [2]check</b>. If you pass, you find a great treasure at the bottom. Draw 2 Unique Items.If you fail a monster awaits you at the bottom.	%	IH	%		%	
Abyss	%	Up ahead, the tunnel branches to the left and to the right.<br><br>If you go left, the tunnel slopes down into darkness, and you hear the strange barking of ghouls up ahead. Make a <b>Luck (-1) [2]check</b>. If you pass, the ghouls are friendly enough, and show you a way out of the tunnels. Return to Arkham. If you fail, they lock you up in a cage. You are <i>delayed</i>.<br><br>If you go right, the tunnel slopes upwards towards a reddish light. Make a <b>Lore (-2) check</b> to notice a magical pattern in the dim light. If you pass, draw 1 Spell. If you fail, nothing happens.	%	IH	%		%	
Abyss	%	The darkness seethes in pursuit, gaining...gaining... lf your Speed is currently 2 or less, you are <i>lost in time and space</i>.	%	KH	%		%	
Abyss	%	You curse your wet matches. knowing for certain that in the light, much would be revealed. Gain <b><font color='#53FF54'>2 Clue Tokens</font></b> if the terror level is 5 or less.	%	KH	%		%	
Abyss	%	Two paths diverge in darkness. Make a <b>Luck (-2) check</b>. If you pass, you are <i>delayed</i> unless you spend a <b><font color='#53FF54'>Clue Token</font></b>. If you fail, you are <i>lost in time and space</i>	%	KH	%		%	
Abyss	%	Out of the darkness, a monster appears! If you defeat it, return to Arkham.	%	KH	%		%	
Abyss	%	Something offers you a deal. Either all other investigators lose their choice of <b><font color='#00A2FE'>1 Sanity</font></b> or <b><font color='#FF4442'>1 Stamina</font></b>, or you are reduced to <b><font color='#00A2FE'>1 Sanity</font></b> and <b><font color='#FF4442'>1 Stamina</font></b>. 	%	KY	%		%	
Abyss	%	Tentacles pull your body in an infinite number of directions... or is that your mind they are shattering, instead? Either your <b><font color='#00A2FE'>Sanity</font></b> is reduced to 1 or your <b><font color='#FF4442'>Stamina</font></b> is reduced to 1. 	%	KY	%		%	
Abyss	%	The air becomes viscous and toxic. Pass a <b>Fight (+0) check</b> to push your way free. If you fail, lose <b><font color='#FF4442'>1 Stamina</font></b> and make the check again. Continue making the check until you are free or you are knocked unconscious. 	%	KY	%		%	
Abyss	%	The ground shakes and a crevasse opens beneath you, threatening to swallow you. Pass a <b>Speed (-1) check</b> or you are <i>lost in time and space</i>. 	%	KY	%		%	
Abyss	%	The horror within erupts from your own throat and attempts to choke you. You lose <b><font color='#FF4442'>Stamina</font></b> equal to the number of points of <b><font color='#00A2FE'>Sanity</font></b> you are currently short of your maximum. 	%	KY	%		%	
Abyss	%	The icy wind howls through the endless tunnels with no sign of relief. Pass a <b>Will (-1) check</b> or lose <b><font color='#00A2FE'>1 Sanity</font></b>. 	%	KY	%		%	
Abyss	%	A subterranean monster appears! 	%	LT	%		%	
Abyss	%	The darkness here is absolute. Pass a <b>Will (-1) check</b> or lose <b><font color='#00A2FE'>1 Sanity</font></b>. 	%	LT	%		%	
Abyss	%	The phosphorescent fungus make this cavern appealing to rest a moment... but the toxic spores they emit prove dangerous! Make a <b>Will (-1) [2]check</b> or lose <b><font color='#00A2FE'>2 Sanity</font></b> and <b><font color='#FF4442'>2 Stamina</font></b>. 	%	LT	%		%	
Abyss	%	You climb a long stone stair towards Sarkomand. Make a <b>Fight (+0) [2]check</b>. If you pass, move to the Dreamlands. If you fail, you become exhausted and must stay here next turn. 	%	LT	%		%	
Abyss	%	You grope blindly in the darkness, desperately avoiding razor-sharp shards of stone. Make a <b>Luck (+1) check</b>. Lose <b><font color='#FF4442'>4 Stamina</font></b>, reduced by 1 per success. 	%	LT	%		%	
Abyss	%	You stumble down a twisting passage and a monster appears! 	%	LT	%		%	
Abyss	%	A monster appears! 	%	MH	%	KH	%	
Abyss	%	The climb across the jagged landscape is brutal. Every stone surface you touch cuts into your flesh. Lose <b><font color='#FF4442'>1 Stamina</font></b>. 	%	MH	%	KH	%	
Abyss	%	The vast desolate landscape gives you no sense of progress. You walk for what seems days and yet you see nothing growing closer, nothing fading away as you move away from it. Lose <b><font color='#00A2FE'>1 Sanity</font></b>. 	%	MH	%	DH	%	
Abyss	%	This place looks familiar, like something from a dream in your childhood. With horror, you recall a nightmare of dying in such a place. Make a <b>Will (-1) check</b>. If you fail, lose <b><font color='#00A2FE'>1 Sanity</font></b> and <b><font color='#FF4442'>1 Stamina</font></b>. 	%	MH	%	DH	%	
Another Time	%	A lurking monster appears! 	%	AH	%		%	
Another Time	%	A book that you thought contained useful information has suddenly turned into a vivid description of methods of torture. Lose <b><font color='#00A2FE'>1 Sanity</font></b>. 	%	BG	%		%	
Another Time	%	A lurking monster appears! 	%	BG	%		%	
Another Time	%	A strangely dressed man accuses you of trying to steal his book. Make a <b>Fight (-2) check</b>. If you succeed, you can take his book away. Take the first Tome in the Unique Item deck. If you fail, lose <b><font color='#FF4442'>1 Stamina</font></b>. 	%	BG	%		%	
Another Time	%	Although the future is a frightening and confusing place, you come across a small statue of yourself, proving that, if nothing else, you made a difference to someone. You may discard 1 Madness card. 	%	DH	%		%	
Another Time	%	An almost-overlooked fragment of text reveals your best course of action. Gain <b><font color='#53FF54'>1 Clue Token</font></b>, plus 1 extra <b><font color='#53FF54'>Clue Token</font></b> for each Tome you have. 	%	DH	%		%
Another Time	%	Awakening, you find yourself in a Victorian masked ball. The night passes in a blur. Stay here next turn. 	%	DH	%		%	
Another Time	%	Finding yourself in a primordial jungle, you are attacked by savage hominids directed by a hovering brain covered in black tentacles. Either pass a <b>Speed (-1) [2]check</b> or discard a Dynamite card to escape from them, gaining <b><font color='#53FF54'>2 Clue Tokens</font></b> in the process. If you do not escape, lose <b><font color='#FF4442'>2 Stamina</font></b> and stay here next turn. 	%	DH	%		%	
Another Time	%	Hurtled forward in time, you witness mankind's final moments. Pass a <b>Will (-2) check</b> or draw a Madness card. 	%	DH	%		%	
Another Time	%	If Shub-Niggurath is the Ancient One, then you are thrown back through the ages to a time when primordial ooze is the only life. Pass a <b>Fight (+0) [3]check</b> to escape powerful grasping tentacles or you are <b>devoured</b>. If Shub-Niggurath is not the Ancient One, nothing happens. 	%	DH	%		%	
Another Time	%	In the far-flung future, you are witness to an Earth that lies in ruin, populated only by hideous beetles. You return wiser, but your mind is unhinged by the experience. Gain <b><font color='#53FF54'>3 Clue Tokens</font></b>, but lose <b><font color='#00A2FE'>3 Sanity</font></b>. 	%	DH	%		%	
Another Time	%	Pass a <b>Luck (-2) check</b> to escape back to the present with a precious object. Draw 1 Unique Item. If you fail, you are stranded in the medieval village. Stay here next turn. 	%	DH	%		%	
Another Time	%	Pass a <b>Luck (-2) check</b> to wake up in an unfamiliar place. You find that you have become another person in a distant time. Years pass as you are married, raise a family, grow old, and finally die. However, it seems that you no sooner close your eyes for the final time than you open them again right back where you started, but with the memories of an extra lifetime. Draw 2 Skills, discarding 1 of them. 	%	DH	%		%	
Another Time	%	Strolling down a quiet street, you are startled to see your mother, dead these many years. She laughs and flirts with a young man you recognize as your father. Smiling, you watch them talk awhile before going on your way. Restore your <b><font color='#00A2FE'>Sanity</font></b> to its maximum value. 	%	DH	%		%	
Another Time	%	Thrown back millions of years, you find that you have swapped bodies with an alien being. Make a <b>Luck (-2) check</b> to try and find a way to switch back. If you pass, return to Arkham. If you fail, you are <b>devoured</b>. 	%	DH	%		%	
Another Time	%	Walking down a shaded lane, you are astonished to see an item that you lost years ago. Draw 1 Common Item. 	%	DH	%		%	
Another Time	%	You are able to rescue a beautiful piece of art from the distant past. Gain $5. 	%	DH	%		%	
Another Time	%	You find yourself in a beautiful garden. Wandering through its lovely paths, you realize that this is the lost Hanging Garden of Babylon. Gain <b><font color='#00A2FE'>2 Sanity</font></b> for witnessing one of the lost wonders of the world. 	%	DH	%		%	
Another Time	%	You find yourself surrounded by clay tablets and scrolls. Search the Unique Item deck and take a Tome of you choice, then regain <b><font color='#00A2FE'>1 Sanity</font></b> as you realize that you've seen the Great Library of Alexandria. 	%	DH	%		%	
Another Time	%	You realize that the Hound has seen you as you gazed at it across the ages. If there is a Hound of Tindalos in the monster cup, it appears. 	%	DH	%		%	
Another Time	%	You recognize this place from your childhood. You used to play here all the time. Gain <b><font color='#00A2FE'>1 Sanity</font></b>. 	%	DH	%		%	
City of the Great Race	%	Glancing behind you, you see that the beasts are still chasing you. Pass a <b>Speed (-1) check</b> or be <i>lost in time and space</i>. 	%	AH	%		%	
City of the Great Race	%	In a flash of insight, you realize the purpose of the bladed artifact. Shivering, you put it back where you found it. Lose <b><font color='#00A2FE'>1 Sanity</font></b> but gain <b><font color='#53FF54'>1 Clue Token</font></b>. 	%	AH	%		%	
City of the Great Race	%	Pass a <b>Luck (-1) check</b> to find something useful among the incomprehensible artifacts. If so, draw 1 Unique Item. 	%	AH	%		%	
City of the Great Race	%	Sometimes, violence is the answer. Pass a <b>Fight (-1) check</b> to break free of your captors and return to Arkham. 	%	AH	%		%	
City of the Great Race	%	The buzzing language of your captors begins to make sense to you. Gain <b><font color='#53FF54'>2 Clue Tokens</font></b>. The you must pass a <b>Luck (-1) check</b> to avoid hearing about the origins of mankind and thereby lose <b><font color='#00A2FE'>2 Sanity</font></b>. 	%	AH	%		%	
City of the Great Race	%	The conical entity tries to teach you some magic. Pass a <b>Lore (-2) [2]check</b> to draw 2 Spells. 	%	AH	%		%	
City of the Great Race	%	The hideous whistling fills your ears. Pass a <b>Will (-1) check</b> or lose <b><font color='#00A2FE'>2 Sanity</font></b>. 	%	AH	%		%	
City of the Great Race	%	The odd plant has you in its clutches. Pass a <b>Fight (-1) check</b> to break free. If you fail, lose <b><font color='#FF4442'>1 Stamina</font></b> and <b><font color='#00A2FE'>1 Sanity</font></b> as it partially digests you. 	%	AH	%		%	
City of the Great Race	%	You find yourself in an ancient and abandoned temple. Pass a <b>Luck (-1) check</b> to find a golden statue worth $10. However, if you take it, you are <i>Cursed</i>. 	%	AH	%		%	
City of the Great Race	%	You may choose to try and infiltrate one of the angled structures. If so, make a <b>Sneak (-1) check</b>. If you pass, draw 2 Unique Items and keep 1 of them. If you fail, you are <i>lost in time and space</i>. 	%	AH	%		%	
City of the Great Race	%	You must have that device if you are to escape from this accursed city. Pass a <b>Sneak (-1) [2]check</b> to draw 1 Unique Item and return to Arkham. If you fail, your captors are none too kind. Lose <b><font color='#00A2FE'>3 Sanity</font></b> and <b><font color='#FF4442'>1 Stamina</font></b>. 	%	AH	%		%	
City of the Great Race	%	You wander the empty streets of the city. No encounter. 	%	AH	%		%	
City of the Great Race	%	One of the strange creatures wants to take one of your items. Pass a <b>Fight (-2) check</b> to hold onto it. if you do not, choose 1 Common or Unique Item and discard it. 	%	BG	%		%	
City of the Great Race	%	The conical creatures wish you to return an item to your own world. They have no need for it. Gain $3. 	%	BG	%		%	
City of the Great Race	%	These creatures don't want you to leave just yet. Pass a <b>Sneak (-3) check</b> or be <i>delayed</i>. 	%	BG	%		%	
City of the Great Race	%	You examine strange glyphs and begin to understand their purpose. Pass a <b>Lore (-2) check</b> to gain 1 Spell. 	%	BG	%		%	
City of the Great Race	%	You feel other minds trying to contact you and warn you of something. Gain <b><font color='#53FF54'>2 Clue Tokens</font></b>. 	%	BG	%		%	
City of the Great Race	%	You read a detailed description of humanity's extinction. Pass a <b>Will (-1) check</b> or lose <b><font color='#00A2FE'>2 Sanity</font></b>. 	%	BG	%		%	
City of the Great Race	%	A monster erupts from the ground and surprises you! You suffer a -2 to all checks against this monster, but you may discard Spells during this combat as if they were <b><font color='#53FF54'>Clue Tokens</font></b>. 	%	CP	%		%	
City of the Great Race	%	Strange instruments of metal and glass surround you. Make a <b>Will (-1) check</b>. If you fail, you are <i>delayed</i>. If you pass, you may discard any number of <b><font color='#53FF54'>Clue Tokens</font></b>, all at once, then draw a number of cards from the Unique Item or Exhibit Item deck equal to the total number of <b><font color='#53FF54'>Clue Tokens</font></b> discarded. You may take one card from among those drawn, then discard the rest. 	%	CP	%		%	
City of the Great Race	%	The conical beings here try to speak to you. Make a <b>Lore (-2) check</b>. If you fail, you are <i>delayed</i>. If you pass, you learn that they are enemies of the Ancient Ones; gain <b><font color='#53FF54'>3 Clue Tokens</font></b>. 	%	CP	%		%	
City of the Great Race	%	These beings knew of senses beyond the five you possess. If your maximum <b><font color='#00A2FE'>Sanity</font></b> is higher than your maximum <b><font color='#FF4442'>Stamina</font></b>, take the Psychic card. If your maximum <b><font color='#FF4442'>Stamina</font></b> is higher than your maximum <b><font color='#00A2FE'>Sanity</font></b>, take the Visions card. 	%	CP	%		%	
City of the Great Race	%	They've been collecting people! Make a <b>Lore (-2) [2]check</b> to determine how to release the victims. If you pass, you may search the Ally deck and take any Ally of your choice. If you fail, you are taken captive yourself, and are <i>delayed</i>. 	%	CP	%		%	
City of the Great Race	%	You may take 1 Spell, but must pass a <b>Will (+0) check</b> or lose <b><font color='#00A2FE'>1 Sanity</font></b>. 	%	CP	%		%	
City of the Great Race	%	Deciding that you have to take the chance if you're to return home, you activate the strange device. Roll a die. On a success, gain <b><font color='#53FF54'>2 Clue Tokens</font></b>. On a failure, nothing happens. 	%	DH	%		%	
City of the Great Race	%	In your wanderings through this city, you come across a strangely marked stone of onyx. Pass a <b>Lore (-1) check</b> to read it and draw 1 Spell. If you fail, stay here next turn. 	%	DH	%		%	
City of the Great Race	%	Make a <b>Luck (-1) [2]check</b>. If you pass, one of the alien scientists imparts a great secret to you. If you have fewer than <b><font color='#53FF54'>5 Clue Tokens</font></b>, you gain enough to bring your total to 5. If you fail, nothing happens. 	%	DH	%		%	
City of the Great Race	%	You've seen the creatures use this machine to learn, but you're not sure what effect it'll have on you. If you use it, make a <b>Luck (-2) check</b> and draw 1 Skill. If you fail the check, however, you also draw 1 Madness card. 	%	DH	%		%	
City of the Great Race	%	The buzzing creature asks if you would prefer to see your past or future.<br><br>If you choose to view your past, the creature shows you a kaleidoscope of images from your life, many of which you had forgotten. Roll a die and gain that many <b><font color='#53FF54'>Clue Tokens</font></b><br><br>If you choose to look at your future, take this card. At any time, instead of rolling for a skill check, you may discard this card to get 3 automatic successes on that skill check.	%	IH	%		%	
City of the Great Race	%	You awaken on a steel table, only to find a strange insect creature performing surgery on you. "Your form is so inefficient," it buzzes, "This one will improve it. Should this one improve your mind or body?"<br><br>If you answer "Mind," draw 3 Skills, keeping 1 and discarding the others. However your maximum <b><font color='#00A2FE'>Sanity</font></b> is reduced by 1.<br><br>If you answer "Body," your maximum <b><font color='#FF4442'>Stamina</font></b> is increased by 1, but you must discard 1 skill and all of your Spells.	%	IH	%		%	
City of the Great Race	%	A flash or insight - the method by which the members or this Great Race project themselves to the future! Choose another investigator and swap locations with him.	%	KH	%		%	
City of the Great Race	%	"Gate-portal?" buzzes its mouths, within your head. "All time-places are gate-portals." You grasp at its meaning, the favor of fortune your only defense against an accidental and disastrous misunderstanding. Pass a <b>Luck (-2) check</b> or take this card. While you have it, your difficulty to close gates is increased by 1. Discard this card when you close a gate.	%	KH	%		%	
City of the Great Race	%	"Transcribe for us every knowledge you possess regarding this object," buzzes the conical being. "Disregard these others." Discard a Unique Item of your choice, then draw a Unique Item. If you have no Unique Items, lose all of your <b><font color='#53FF54'>Clue Tokens</font></b>.	%	KH	%		%	
City of the Great Race	%	You awaken briefly and stare at your hands, which are the hands of another. Choose another investigator and take all of his <b><font color='#53FF54'>Clue Tokens</font></b>. Lose <b><font color='#00A2FE'>1 Sanity</font></b>.	%	KH	%		%	
City of the Great Race	%	All cities are but a reflection of Carcosa. Make a <b>Lore (-2) check</b> to remember the street's patterns from "The King in Yellow." If you pass, you immediately return to Arkham. If you fail, you are <i>delayed</i>. 	%	KY	%		%	
City of the Great Race	%	Alone and far from home you've struggled. Pass a <b>Will (-2) check</b> or lose <b><font color='#00A2FE'>2 Sanity</font></b>. 	%	KY	%		%	
City of the Great Race	%	Coming to, you find yourself strapped down to a table. One of the strange beings picks up a sharp metal instrument and brings it towards your eye. You are <i>delayed</i> and lose <b><font color='#00A2FE'>1 Sanity</font></b>. 	%	KY	%		%	
City of the Great Race	%	In this alien place, mundane objects serve to remind you that Earth still exists, somewhere, somewhen. Pass a <b>Will (-3) check</b> to gain <b><font color='#00A2FE'>2 Sanity</font></b>. You gain a +1 bonus to the check for each Common Item you have. 	%	KY	%		%	
City of the Great Race	%	The bells ring ten, eleven, then midnight. But what does time mean, here? If you <b><font color='#00A2FE'>Sanity</font></b> is 3 or less, you are <i>lost in time and space</i>. 	%	KY	%		%	
City of the Great Race	%	You find a map of this strange place. The streets are laid out in a horrible pattern! Pass a <b>Will (+1) check</b> or lose <b><font color='#00A2FE'>1 Sanity</font></b>. 	%	KY	%		%	
